29,Cliente_29,9.91,Entrega Padrão,Cartão Débito,2024-09-16 20:24:00,"Atum, Mexicana, Mussarela, Mexicana, Cerveja Long Neck, Refrigerante 2L",164.0,6,1,1
91,Cliente_91,8.91,Entrega Padrão,Cartão Débito,2024-10-15 20:44:00,Milho com Bacon,28.5,1,1,0
101,Cliente_101,12.83,Retirada,Cartão Débito,2024-02-10 19:28:00,Atum,28.0,1,1,0
119,Cliente_119,13.82,Retirada,Cartão Crédito,2024-01-13 21:07:00,"Chocolate, Brócolis com Bacon, Refrigerante 2L, Refrigerante Lata",67.0,4,1,1
180,Cliente_180,13.33,Retirada,Cartão Débito,2024-09-03 23:59:00,"Alho e Óleo, Alho e Óleo, Português, Milho com Bacon, Brócolis com Bacon",138.5,5,1,0
134,Cliente_134,14.75,Entrega Rápida,Cartão Crédito,2024-05-04 21:32:00,"Refrigerante Lata, Cerveja Long Neck, Cerveja Long Neck",29.0,3,0,1
182,Cliente_182,12.16,Entrega Rápida,Dinheiro,2024-12-25 18:40:00,"Strogonoff de Carne, Abacaxi, Pepperoni, Cerveja Long Neck, Refrigerante Lata",104.0,5,1,1
34,Cliente_34,2.09,Entrega Rápida,PIX,2024-08-15 19:59:00,"Frango com Catupiry, Refrigerante 2L, Cerveja Long Neck",52.0,3,1,1
24,Cliente_24,12.44,Entrega Padrão,Cartão Crédito,2024-09-16 20:26:00,"Strogonoff de Frango, Carne Seca, Refrigerante 2L",76.5,3,1,1
52,Cliente_52,14.15,Retirada,Cartão Crédito,2024-04-02 18:44:00,"Carne Seca, Mexicana, Alho e Óleo, Palmito, Strogonoff de Frango",154.0,5,1,0
131,Cliente_131,4.45,Retirada,Dinheiro,2024-08-19 22:06:00,"Mussarela, Mexicana, Alho e Óleo, Mussarela, Cerveja Long Neck",170.0,5,1,1
155,Cliente_155,2.35,Entrega Padrão,Cartão Crédito,2024-05-16 20:48:00,"Mussarela, Napolitana, Cerveja Lata",82.5,3,1,1
64,Cliente_64,7.46,Retirada,Cartão Débito,2024-07-29 18:18:00,"Português, Abacaxi, Refrigerante 2L",61.0,3,1,1
71,Cliente_71,13.36,Entrega Rápida,Cartão Crédito,2024-10-14 21:48:00,Cerveja Long Neck,12.0,1,0,1
154,Cliente_154,14.49,Retirada,Cartão Débito,2024-07-22 19:23:00,"Carne Seca, Vegetariana, Calabresa, Mussarela, Atum, Cerveja Lata, Cerveja Long Neck, Cerveja Long Neck",197.5,8,1,1
19,Cliente_19,7.77,Entrega Rápida,Cartão Débito,2024-09-25 18:50:00,"Lombo com Catupiry, Strogonoff de Frango, Margarida, Português, Banana com Canela, Refrigerante Lata",143.5,6,1,1
200,Cliente_200,14.18,Retirada,Cartão Débito,2024-03-31 20:27:00,"Margarida, Catupiry, Pesto, Milho com Bacon, Cerveja Long Neck",124.0,5,1,1
35,Cliente_35,10.17,Entrega Padrão,PIX,2024-08-19 21:24:00,,0.0,0,0,0
71,Cliente_71,9.14,Entrega Padrão,PIX,2024-07-19 23:32:00,"Romeu e Julieta, Milho com Bacon, Strogonoff de Carne, Refrigerante 2L, Cerveja Lata, Refrigerante Lata",107.0,6,1,1
44,Cliente_44,11.05,Retirada,Cartão Débito,2024-01-06 19:10:00,"Quatro Queijos, Chocolate, Pepperoni, Refrigerante 2L",92.0,4,1,1
55,Cliente_55,4.09,Entrega Rápida,Cartão Débito,2024-07-12 21:52:00,"Frango com Catupiry, Cerveja Lata, Cerveja Long Neck",49.0,3,1,1
109,Cliente_109,11.34,Entrega Rápida,PIX,2024-07-21 20:14:00,"Mussarela, Vegetariana, Refrigerante 2L, Refrigerante Lata, Refrigerante 2L",102.0,5,1,1
151,Cliente_151,9.65,Entrega Padrão,Dinheiro,2024-12-22 22:46:00,"Margarida, Refrigerante Lata",31.5,2,1,1
91,Cliente_91,12.64,Entrega Padrão,PIX,2024-02-22 18:19:00,"Prestígio, Sorvete, Carne Seca, Refrigerante 2L, Refrigerante 2L, Cerveja Long Neck",116.5,6,1,1
32,Cliente_32,2.82,Retirada,Cartão Crédito,2024-06-28 23:21:00,"Cerveja Lata, Cerveja Long Neck, Refrigerante Lata",24.0,3,0,1
62,Cliente_62,1.56,Retirada,Cartão Débito,2024-05-12 19:07:00,"Strogonoff de Carne, Mexicana, Abacaxi, Cerveja Long Neck",100.0,4,1,1
76,Cliente_76,7.09,Retirada,Cartão Crédito,2024-12-05 19:22:00,"Brócolis com Bacon, Frango com Catupiry, Palmito, Lombo com Catupiry, Carne Seca, Cerveja Long Neck, Refrigerante Lata, Cerveja Long Neck",182.5,8,1,1
100,Cliente_100,13.95,Retirada,Cartão Débito,2024-02-05 19:41:00,"Pepperoni, Cerveja Lata, Cerveja Lata",45.0,3,1,1
41,Cliente_41,12.3,Retirada,Dinheiro,2024-06-29 21:11:00,"Napolitana, Atum, Romeu e Julieta, Alho e Óleo, Cerveja Lata, Refrigerante Lata, Refrigerante Lata",120.0,7,1,1
74,Cliente_74,9.62,Retirada,Cartão Débito,2024-05-14 22:08:00,"Strogonoff de Frango, Frango com Catupiry, Refrigerante Lata, Refrigerante 2L, Refrigerante 2L",87.5,5,1,1
86,Cliente_86,4.58,Entrega Padrão,Cartão Débito,2024-08-20 20:53:00,"Mussarela, Strogonoff de Carne, Romeu e Julieta, Bacon, Quatro Queijos, Refrigerante 2L, Refrigerante 2L",184.0,7,1,1
30,Cliente_30,10.6,Entrega Rápida,Cartão Débito,2024-05-05 22:03:00,"Pepperoni, Strogonoff de Carne, Pepperoni, Pesto, Quatro Queijos, Cerveja Long Neck, Cerveja Long Neck",175.5,7,1,1
160,Cliente_160,1.82,Retirada,Cartão Crédito,2024-02-25 20:26:00,"Cerveja Lata, Cerveja Long Neck",19.0,2,0,1
28,Cliente_28,12.43,Entrega Padrão,Cartão Crédito,2024-05-04 22:37:00,"Chocolate com Morango, Chocolate com Morango, Palmito",79.5,3,1,0
58,Cliente_58,13.45,Retirada,Cartão Débito,2024-06-04 18:32:00,"Atum, Brócolis com Bacon, Camarão, Atum, Abacaxi",144.0,5,1,0
17,Cliente_17,13.62,Retirada,Cartão Crédito,2024-10-06 19:43:00,"Alho e Óleo, Strogonoff de Frango, Frango com Catupiry, Sorvete, Carne Seca, Refrigerante Lata",153.5,6,1,1
181,Cliente_181,12.73,Retirada,PIX,2024-06-18 21:40:00,"Milho com Bacon, Abacaxi, Lombo com Catupiry, Abacaxi, Lombo com Catupiry, Cerveja Lata, Refrigerante 2L, Refrigerante Lata",156.5,8,1,1
8,Cliente_8,6.57,Entrega Padrão,PIX,2024-09-16 19:55:00,"Camarão, Bacon, Pesto, Carne Seca",125.0,4,1,0
177,Cliente_177,2.91,Retirada,Cartão Crédito,2024-04-13 18:04:00,"Refrigerante 2L, Refrigerante 2L, Refrigerante 2L",30.0,3,0,1
27,Cliente_27,8.11,Retirada,PIX,2024-11-24 22:05:00,"Cerveja Lata, Cerveja Lata, Cerveja Lata",21.0,3,0,1
9,Cliente_9,0.94,Entrega Padrão,Cartão Débito,2024-07-15 23:04:00,"Calabresa, Refrigerante Lata, Cerveja Long Neck",44.5,3,1,1
110,Cliente_110,5.53,Entrega Rápida,Cartão Débito,2024-01-14 23:01:00,"Calabresa, Vegetariana, Banana com Canela, Milho com Bacon, Quatro Queijos, Refrigerante Lata, Cerveja Lata, Refrigerante Lata",150.5,8,1,1
180,Cliente_180,3.0,Retirada,PIX,2024-08-27 20:41:00,"Brócolis com Bacon, Brócolis com Bacon, Refrigerante Lata, Cerveja Long Neck",77.0,4,1,1
17,Cliente_17,6.78,Entrega Padrão,Cartão Débito,2024-03-16 18:30:00,"Frango com Catupiry, Strogonoff de Carne",63.0,2,1,0
140,Cliente_140,9.69,Entrega Padrão,PIX,2024-07-09 18:13:00,"Quatro Queijos, Strogonoff de Carne, Strogonoff de Carne, Strogonoff de Carne, Brócolis com Bacon, Refrigerante Lata, Refrigerante 2L, Cerveja Lata",180.0,8,1,1
164,Cliente_164,14.3,Entrega Padrão,PIX,2024-11-02 21:59:00,"Prestígio, Brócolis com Bacon, Mussarela, Napolitana",130.0,4,1,0
125,Cliente_125,6.32,Entrega Rápida,Cartão Crédito,2024-07-19 19:25:00,"Prestígio, Mussarela, Cerveja Long Neck, Cerveja Long Neck, Cerveja Long Neck",110.5,5,1,1
43,Cliente_43,12.55,Retirada,Cartão Crédito,2024-01-31 18:21:00,"Quatro Queijos, Quatro Queijos, Quatro Queijos, Romeu e Julieta, Milho com Bacon, Cerveja Lata",146.0,6,1,1
115,Cliente_115,12.57,Entrega Rápida,Cartão Débito,2024-10-01 22:15:00,"Romeu e Julieta, Bacon, Mexicana, Cerveja Long Neck, Cerveja Long Neck, Cerveja Lata",115.0,6,1,1
135,Cliente_135,12.15,Retirada,Dinheiro,2024-02-12 22:30:00,"Refrigerante Lata, Cerveja Long Neck, Cerveja Long Neck",29.0,3,0,1
137,Cliente_137,7.25,Entrega Rápida,Cartão Crédito,2024-04-07 18:20:00,"Bacon, Vegetariana, Cerveja Long Neck, Refrigerante 2L, Refrigerante 2L",87.5,5,1,1
16,Cliente_16,7.52,Entrega Padrão,PIX,2024-06-30 20:39:00,"Cerveja Lata, Cerveja Long Neck, Refrigerante Lata",24.0,3,0,1
85,Cliente_85,5.36,Entrega Rápida,Cartão Débito,2024-11-30 22:08:00,"Sorvete, Chocolate, Cerveja Long Neck, Cerveja Lata, Refrigerante Lata",72.0,5,1,1
45,Cliente_45,8.93,Entrega Rápida,Cartão Débito,2024-11-14 20:42:00,"Atum, Cerveja Long Neck, Cerveja Lata, Cerveja Lata",54.0,4,1,1
161,Cliente_161,9.27,Retirada,PIX,2024-02-21 21:34:00,"Strogonoff de Carne, Cerveja Lata, Refrigerante 2L, Cerveja Lata",57.0,4,1,1
127,Cliente_127,10.76,Retirada,Dinheiro,2024-07-23 19:55:00,"Atum, Calabresa, Palmito, Abacaxi, Banana com Canela, Cerveja Lata",136.5,6,1,1
176,Cliente_176,2.03,Entrega Rápida,Cartão Crédito,2024-10-27 22:59:00,"Refrigerante Lata, Cerveja Lata, Cerveja Lata",19.0,3,0,1
155,Cliente_155,4.55,Entrega Rápida,Dinheiro,2024-02-03 19:30:00,"Pesto, Pesto, Sorvete, Catupiry, Cerveja Long Neck, Refrigerante 2L, Cerveja Long Neck",144.5,7,1,1
181,Cliente_181,3.9,Retirada,Dinheiro,2024-01-03 19:10:00,"Refrigerante Lata, Refrigerante 2L",15.0,2,0,1
91,Cliente_91,12.75,Entrega Padrão,PIX,2024-07-01 23:54:00,"Strogonoff de Carne, Atum, Carne Seca, Refrigerante Lata, Cerveja Long Neck, Cerveja Long Neck",124.0,6,1,1
177,Cliente_177,4.46,Entrega Rápida,PIX,2024-11-22 23:12:00,"Strogonoff de Frango, Alho e Óleo, Cerveja Long Neck, Refrigerante Lata, Cerveja Long Neck",87.5,5,1,1
150,Cliente_150,9.76,Entrega Rápida,Cartão Débito,2024-07-04 21:32:00,,0.0,0,0,0
93,Cliente_93,13.36,Retirada,Dinheiro,2024-11-21 18:19:00,"Refrigerante Lata, Refrigerante 2L",15.0,2,0,1
59,Cliente_59,0.96,Entrega Rápida,PIX,2024-03-18 18:25:00,"Abacaxi, Lombo com Catupiry",53.0,2,1,0
37,Cliente_37,2.55,Retirada,Cartão Débito,2024-08-27 19:01:00,"Strogonoff de Carne, Frango com Catupiry, Quatro Queijos, Refrigerante Lata, Cerveja Lata, Refrigerante 2L",114.0,6,1,1
163,Cliente_163,5.53,Entrega Rápida,PIX,2024-08-30 18:40:00,"Milho com Bacon, Vegetariana, Catupiry, Cerveja Long Neck",97.0,4,1,1
157,Cliente_157,2.07,Retirada,Cartão Débito,2024-12-22 21:10:00,"Catupiry, Abacaxi, Strogonoff de Frango, Cerveja Long Neck, Cerveja Long Neck",109.0,5,1,1
143,Cliente_143,14.22,Entrega Rápida,Cartão Crédito,2024-05-01 19:34:00,Cerveja Lata,7.0,1,0,1
133,Cliente_133,11.68,Entrega Padrão,Cartão Crédito,2024-07-24 19:00:00,"Frango com Catupiry, Carne Seca, Refrigerante Lata, Refrigerante Lata, Refrigerante 2L",84.0,5,1,1
52,Cliente_52,4.07,Retirada,Dinheiro,2024-10-16 21:18:00,"Palmito, Brócolis com Bacon, Abacaxi, Cerveja Lata",89.5,4,1,1
41,Cliente_41,8.12,Entrega Rápida,Cartão Crédito,2024-05-11 22:21:00,"Chocolate com Morango, Banana com Canela, Pepperoni, Alho e Óleo, Strogonoff de Frango, Cerveja Lata, Refrigerante Lata, Refrigerante 2L",158.0,8,1,1
146,Cliente_146,10.43,Entrega Padrão,PIX,2024-06-17 20:05:00,"Banana com Canela, Vegetariana, Mexicana, Atum, Cerveja Lata, Refrigerante Lata",120.5,6,1,1
49,Cliente_49,12.25,Entrega Rápida,Dinheiro,2024-04-09 18:47:00,"Pesto, Calabresa, Mexicana, Banana com Canela, Atum",136.5,5,1,0
34,Cliente_34,0.55,Entrega Padrão,Dinheiro,2024-06-22 19:32:00,"Pesto, Carne Seca, Napolitana, Alho e Óleo, Cerveja Lata, Cerveja Long Neck",132.0,6,1,1
11,Cliente_11,7.55,Retirada,PIX,2024-01-10 18:32:00,"Banana com Canela, Brócolis com Bacon",51.5,2,1,0
69,Cliente_69,13.93,Entrega Rápida,Dinheiro,2024-02-08 22:20:00,"Português, Napolitana, Napolitana, Prestígio, Refrigerante 2L, Cerveja Long Neck, Refrigerante 2L",135.5,7,1,1
148,Cliente_148,1.18,Retirada,Dinheiro,2024-06-09 22:11:00,"Pesto, Abacaxi, Camarão, Português, Português, Refrigerante 2L, Cerveja Long Neck",163.5,7,1,1
133,Cliente_133,4.23,Retirada,Cartão Crédito,2024-10-12 22:17:00,"Refrigerante Lata, Refrigerante 2L",15.0,2,0,1
64,Cliente_64,6.48,Entrega Rápida,Cartão Débito,2024-09-16 22:17:00,"Cerveja Long Neck, Refrigerante 2L",22.0,2,0,1
179,Cliente_179,4.26,Entrega Padrão,PIX,2024-05-06 23:30:00,"Margarida, Quatro Queijos, Refrigerante 2L, Cerveja Long Neck",77.5,4,1,1
56,Cliente_56,5.98,Entrega Padrão,Cartão Crédito,2024-10-01 20:57:00,"Bacon, Vegetariana, Refrigerante 2L, Refrigerante 2L",75.5,4,1,1
182,Cliente_182,1.4,Entrega Rápida,Dinheiro,2024-01-28 19:10:00,"Lombo com Catupiry, Mussarela, Chocolate com Morango, Pesto, Refrigerante 2L",142.5,5,1,1
23,Cliente_23,4.53,Entrega Rápida,Cartão Crédito,2024-10-10 18:53:00,"Napolitana, Português, Pepperoni, Frango com Catupiry, Mexicana, Cerveja Long Neck",158.5,6,1,1
49,Cliente_49,10.06,Retirada,Cartão Débito,2024-04-27 21:33:00,"Atum, Cerveja Long Neck",40.0,2,1,1
145,Cliente_145,3.51,Entrega Padrão,Dinheiro,2024-02-05 19:07:00,"Bacon, Mussarela, Cerveja Long Neck",90.5,3,1,1
84,Cliente_84,6.75,Retirada,PIX,2024-12-22 22:39:00,"Napolitana, Vegetariana, Abacaxi, Banana com Canela, Cerveja Lata",104.0,5,1,1
128,Cliente_128,3.27,Retirada,Cartão Crédito,2024-09-10 19:01:00,"Português, Cerveja Lata, Refrigerante 2L",45.0,3,1,1
136,Cliente_136,13.51,Retirada,Cartão Crédito,2024-04-21 23:53:00,"Camarão, Refrigerante Lata, Cerveja Lata",47.0,3,1,1
32,Cliente_32,1.65,Entrega Padrão,Cartão Crédito,2024-04-20 21:38:00,"Bacon, Frango com Catupiry, Sorvete, Cerveja Long Neck, Refrigerante Lata, Cerveja Lata",108.5,6,1,1
195,Cliente_195,3.77,Entrega Padrão,Cartão Crédito,2024-04-20 21:43:00,"Strogonoff de Carne, Strogonoff de Carne, Romeu e Julieta, Cerveja Long Neck, Cerveja Lata, Refrigerante Lata",113.5,6,1,1
149,Cliente_149,9.52,Entrega Padrão,PIX,2024-03-31 21:39:00,"Pepperoni, Atum, Cerveja Lata",66.0,3,1,1
35,Cliente_35,10.4,Retirada,Cartão Débito,2024-12-22 20:23:00,,0.0,0,0,0
154,Cliente_154,7.41,Entrega Padrão,Dinheiro,2024-12-26 19:24:00,"Sorvete, Alho e Óleo, Cerveja Long Neck, Cerveja Long Neck",76.0,4,1,1
153,Cliente_153,8.7,Entrega Padrão,Cartão Débito,2024-06-11 19:18:00,"Calabresa, Camarão, Vegetariana, Chocolate, Margarida",138.0,5,1,0
72,Cliente_72,4.86,Entrega Rápida,Cartão Crédito,2024-02-11 23:57:00,"Sorvete, Carne Seca",60.0,2,1,0
166,Cliente_166,5.88,Entrega Padrão,Dinheiro,2024-03-29 23:09:00,"Mussarela, Abacaxi, Banana com Canela, Calabresa, Carne Seca, Cerveja Long Neck, Refrigerante 2L",178.0,7,1,1
127,Cliente_127,1.78,Entrega Padrão,Cartão Débito,2024-04-08 20:07:00,Sorvete,26.0,1,1,0
9,Cliente_9,1.0,Retirada,Dinheiro,2024-01-20 21:08:00,"Frango com Catupiry, Quatro Queijos, Bacon, Bacon, Cerveja Lata, Cerveja Lata, Refrigerante Lata",135.0,7,1,1
116,Cliente_116,12.89,Retirada,PIX,2024-09-25 22:00:00,"Mussarela, Cerveja Long Neck, Cerveja Lata",69.0,3,1,1
76,Cliente_76,5.02,Entrega Padrão,PIX,2024-05-12 21:30:00,"Refrigerante Lata, Refrigerante Lata",10.0,2,0,1
123,Cliente_123,4.22,Entrega Padrão,Dinheiro,2024-01-02 19:06:00,"Lombo com Catupiry, Lombo com Catupiry, Milho com Bacon, Vegetariana, Lombo com Catupiry, Cerveja Long Neck, Refrigerante 2L, Refrigerante Lata",172.5,8,1,1
48,Cliente_48,5.64,Entrega Rápida,Dinheiro,2024-05-07 19:09:00,"Strogonoff de Carne, Sorvete, Refrigerante 2L, Refrigerante Lata",74.0,4,1,1
80,Cliente_80,8.42,Entrega Padrão,Cartão Crédito,2024-03-16 19:11:00,"Strogonoff de Carne, Português, Margarida, Chocolate com Morango, Brócolis com Bacon, Cerveja Lata, Refrigerante Lata, Refrigerante 2L",164.5,8,1,1
177,Cliente_177,7.72,Entrega Padrão,PIX,2024-06-01 18:14:00,"Milho com Bacon, Carne Seca, Romeu e Julieta, Refrigerante 2L, Refrigerante Lata",101.0,5,1,1
150,Cliente_150,10.74,Entrega Rápida,Cartão Crédito,2024-10-05 22:22:00,"Cerveja Long Neck, Cerveja Long Neck",24.0,2,0,1
87,Cliente_87,11.15,Entrega Rápida,Cartão Débito,2024-05-09 23:19:00,"Frango com Catupiry, Mexicana, Refrigerante Lata",67.0,3,1,1
69,Cliente_69,9.56,Retirada,Cartão Crédito,2024-09-17 20:12:00,"Romeu e Julieta, Refrigerante 2L, Refrigerante Lata, Refrigerante Lata",43.5,4,1,1
66,Cliente_66,10.55,Entrega Padrão,Cartão Débito,2024-12-08 20:31:00,"Strogonoff de Carne, Margarida, Carne Seca, Cerveja Lata, Cerveja Lata, Refrigerante 2L",117.5,6,1,1
97,Cliente_97,7.51,Entrega Padrão,Dinheiro,2024-08-13 21:58:00,"Palmito, Chocolate",51.5,2,1,0
81,Cliente_81,14.2,Entrega Padrão,PIX,2024-09-22 21:07:00,"Quatro Queijos, Banana com Canela",50.5,2,1,0
9,Cliente_9,10.62,Entrega Padrão,Cartão Crédito,2024-11-13 19:59:00,Milho com Bacon,28.5,1,1,0
124,Cliente_124,1.27,Entrega Padrão,PIX,2024-07-01 23:50:00,"Chocolate com Morango, Refrigerante Lata",30.0,2,1,1
38,Cliente_38,0.55,Retirada,Dinheiro,2024-07-24 19:10:00,"Calabresa, Lombo com Catupiry, Cerveja Long Neck",69.5,3,1,1
78,Cliente_78,9.79,Entrega Rápida,Cartão Débito,2024-09-03 19:57:00,"Catupiry, Cerveja Long Neck",41.5,2,1,1
36,Cliente_36,0.62,Entrega Rápida,Cartão Débito,2024-11-03 22:15:00,"Bacon, Milho com Bacon, Lombo com Catupiry, Sorvete, Camarão",148.0,5,1,0
163,Cliente_163,13.53,Entrega Padrão,Cartão Débito,2024-08-02 23:27:00,"Napolitana, Refrigerante 2L, Refrigerante 2L, Cerveja Long Neck",57.5,4,1,1
39,Cliente_39,1.43,Entrega Padrão,Cartão Débito,2024-10-23 23:06:00,"Margarida, Português, Cerveja Lata",61.5,3,1,1
49,Cliente_49,7.82,Retirada,Cartão Crédito,2024-05-22 23:32:00,"Pepperoni, Cerveja Lata, Refrigerante 2L, Cerveja Long Neck",60.0,4,1,1
167,Cliente_167,4.39,Entrega Padrão,Dinheiro,2024-04-05 21:36:00,"Bacon, Mussarela, Vegetariana, Prestígio",130.0,4,1,0
36,Cliente_36,8.82,Entrega Padrão,PIX,2024-08-06 20:40:00,"Banana com Canela, Strogonoff de Frango, Pesto, Lombo com Catupiry, Milho com Bacon, Refrigerante 2L, Refrigerante 2L",160.0,7,1,1
85,Cliente_85,2.38,Entrega Padrão,Dinheiro,2024-03-28 21:54:00,"Vegetariana, Banana com Canela, Cerveja Lata, Refrigerante 2L",65.5,4,1,1
84,Cliente_84,5.54,Retirada,Dinheiro,2024-04-27 20:37:00,"Quatro Queijos, Mexicana, Vegetariana, Lombo com Catupiry, Sorvete, Refrigerante 2L",154.0,6,1,1
90,Cliente_90,7.28,Entrega Rápida,Dinheiro,2024-09-12 22:26:00,"Margarida, Margarida, Lombo com Catupiry, Refrigerante 2L, Refrigerante 2L",103.0,5,1,1
101,Cliente_101,5.29,Entrega Padrão,PIX,2024-02-08 19:56:00,"Abacaxi, Refrigerante 2L, Refrigerante Lata, Cerveja Long Neck",50.0,4,1,1
65,Cliente_65,3.13,Entrega Padrão,Cartão Crédito,2024-05-24 18:59:00,"Brócolis com Bacon, Atum, Atum, Chocolate, Refrigerante 2L, Cerveja Long Neck",130.0,6,1,1
186,Cliente_186,5.65,Retirada,Cartão Crédito,2024-09-06 19:49:00,"Mexicana, Catupiry, Milho com Bacon, Alho e Óleo",116.0,4,1,0
111,Cliente_111,14.33,Entrega Rápida,Dinheiro,2024-04-17 19:40:00,Cerveja Lata,7.0,1,0,1
189,Cliente_189,8.36,Entrega Padrão,Cartão Débito,2024-05-22 20:07:00,,0.0,0,0,0
106,Cliente_106,2.3,Retirada,PIX,2024-03-26 23:25:00,"Camarão, Frango com Catupiry, Strogonoff de Frango, Napolitana, Pesto, Cerveja Lata, Refrigerante 2L",167.5,7,1,1
181,Cliente_181,13.38,Entrega Padrão,Cartão Débito,2024-12-04 23:31:00,,0.0,0,0,0
162,Cliente_162,10.95,Entrega Rápida,Cartão Crédito,2024-06-26 19:00:00,"Cerveja Long Neck, Refrigerante Lata",17.0,2,0,1
153,Cliente_153,5.63,Entrega Padrão,PIX,2024-04-20 23:05:00,Refrigerante 2L,10.0,1,0,1
187,Cliente_187,7.07,Entrega Rápida,Cartão Débito,2024-04-18 21:14:00,"Mussarela, Lombo com Catupiry, Brócolis com Bacon, Milho com Bacon, Refrigerante Lata",143.5,5,1,1
113,Cliente_113,9.16,Entrega Padrão,Cartão Débito,2024-08-10 19:38:00,"Mussarela, Camarão, Refrigerante Lata, Cerveja Lata",97.0,4,1,1
125,Cliente_125,14.67,Entrega Padrão,Cartão Crédito,2024-07-31 22:12:00,"Prestígio, Português, Frango com Catupiry, Cerveja Lata, Refrigerante 2L, Refrigerante 2L",109.5,6,1,1
167,Cliente_167,4.21,Retirada,Dinheiro,2024-07-24 18:16:00,"Refrigerante 2L, Refrigerante 2L, Cerveja Long Neck",32.0,3,0,1
143,Cliente_143,5.07,Entrega Padrão,Cartão Crédito,2024-11-13 21:49:00,"Margarida, Milho com Bacon, Português, Milho com Bacon, Carne Seca, Cerveja Lata",152.5,6,1,1
17,Cliente_17,6.67,Retirada,Dinheiro,2024-08-03 23:42:00,,0.0,0,0,0
188,Cliente_188,8.96,Entrega Padrão,PIX,2024-11-15 22:15:00,"Camarão, Frango com Catupiry, Strogonoff de Carne, Pesto, Português, Refrigerante Lata, Cerveja Lata, Cerveja Long Neck",177.5,8,1,1
131,Cliente_131,1.41,Entrega Padrão,Cartão Crédito,2024-09-04 21:27:00,"Romeu e Julieta, Banana com Canela, Pepperoni, Strogonoff de Carne, Refrigerante Lata, Refrigerante 2L, Refrigerante 2L",134.0,7,1,1
199,Cliente_199,7.25,Entrega Padrão,Cartão Débito,2024-10-31 18:22:00,"Banana com Canela, Chocolate, Refrigerante Lata, Cerveja Long Neck, Refrigerante 2L",70.5,5,1,1
75,Cliente_75,4.29,Entrega Padrão,PIX,2024-02-26 21:38:00,"Atum, Chocolate, Pesto, Alho e Óleo, Português, Refrigerante 2L, Refrigerante Lata",146.5,7,1,1
97,Cliente_97,10.29,Entrega Rápida,Cartão Débito,2024-08-26 20:55:00,"Alho e Óleo, Strogonoff de Carne, Refrigerante 2L, Cerveja Lata, Refrigerante Lata",81.0,5,1,1
177,Cliente_177,11.9,Entrega Rápida,Cartão Crédito,2024-10-16 20:45:00,"Mexicana, Refrigerante Lata, Cerveja Long Neck, Refrigerante 2L",59.0,4,1,1
31,Cliente_31,1.57,Entrega Padrão,Cartão Crédito,2024-08-03 20:04:00,"Pepperoni, Brócolis com Bacon, Português, Cerveja Lata, Cerveja Lata, Refrigerante 2L",113.0,6,1,1
148,Cliente_148,4.55,Entrega Rápida,Cartão Débito,2024-12-09 20:54:00,"Chocolate com Morango, Bacon, Bacon, Frango com Catupiry, Lombo com Catupiry",142.0,5,1,0
37,Cliente_37,10.34,Entrega Rápida,Cartão Crédito,2024-11-16 19:39:00,"Cerveja Lata, Cerveja Lata, Refrigerante 2L",24.0,3,0,1
97,Cliente_97,5.41,Entrega Padrão,Cartão Débito,2024-07-27 22:21:00,"Milho com Bacon, Vegetariana, Pepperoni, Margarida",113.0,4,1,0
60,Cliente_60,6.18,Retirada,Dinheiro,2024-02-05 19:46:00,"Abacaxi, Brócolis com Bacon, Cerveja Lata",60.0,3,1,1
199,Cliente_199,9.44,Entrega Padrão,Cartão Crédito,2024-07-15 20:11:00,"Português, Milho com Bacon, Refrigerante 2L, Refrigerante 2L",76.5,4,1,1
92,Cliente_92,4.69,Retirada,Cartão Débito,2024-06-25 19:48:00,"Mussarela, Cerveja Lata, Cerveja Lata, Refrigerante 2L",74.0,4,1,1
180,Cliente_180,13.09,Retirada,Cartão Crédito,2024-10-08 20:16:00,Vegetariana,27.0,1,1,0
138,Cliente_138,8.72,Entrega Padrão,Dinheiro,2024-03-16 22:17:00,"Bacon, Alho e Óleo",54.5,2,1,0
142,Cliente_142,2.75,Entrega Rápida,PIX,2024-07-04 19:18:00,"Strogonoff de Carne, Refrigerante Lata, Refrigerante Lata, Refrigerante Lata",48.0,4,1,1
26,Cliente_26,4.99,Entrega Padrão,Cartão Débito,2024-11-09 21:38:00,"Strogonoff de Carne, Strogonoff de Carne, Palmito, Cerveja Lata",102.5,4,1,1
174,Cliente_174,5.56,Entrega Rápida,PIX,2024-06-11 18:35:00,"Milho com Bacon, Catupiry, Alho e Óleo",84.0,3,1,0
13,Cliente_13,11.12,Retirada,Dinheiro,2024-07-04 18:57:00,"Palmito, Frango com Catupiry, Sorvete, Mexicana",117.5,4,1,0
189,Cliente_189,5.39,Retirada,PIX,2024-05-19 23:49:00,"Frango com Catupiry, Margarida, Refrigerante 2L, Refrigerante 2L",76.5,4,1,1
62,Cliente_62,14.96,Retirada,PIX,2024-08-05 19:07:00,"Sorvete, Mexicana, Calabresa, Bacon",114.0,4,1,0
186,Cliente_186,8.25,Entrega Padrão,Cartão Crédito,2024-04-13 23:47:00,"Calabresa, Refrigerante Lata",32.5,2,1,1
88,Cliente_88,7.47,Entrega Padrão,Cartão Débito,2024-11-21 20:33:00,Cerveja Long Neck,12.0,1,0,1
133,Cliente_133,14.37,Entrega Rápida,Dinheiro,2024-08-11 23:50:00,"Pepperoni, Refrigerante Lata, Cerveja Lata, Refrigerante Lata",48.0,4,1,1
149,Cliente_149,11.3,Entrega Padrão,PIX,2024-08-17 18:16:00,"Mussarela, Refrigerante 2L, Cerveja Long Neck, Cerveja Long Neck",84.0,4,1,1
45,Cliente_45,2.45,Entrega Padrão,Cartão Crédito,2024-06-20 23:16:00,"Camarão, Frango com Catupiry, Catupiry, Cerveja Long Neck, Cerveja Lata, Refrigerante 2L",123.5,6,1,1
176,Cliente_176,9.98,Entrega Padrão,Dinheiro,2024-07-20 23:14:00,"Brócolis com Bacon, Chocolate com Morango, Catupiry, Vegetariana, Margarida, Cerveja Long Neck, Refrigerante Lata",155.0,7,1,1
197,Cliente_197,13.59,Retirada,Cartão Crédito,2024-06-12 18:49:00,"Camarão, Prestígio, Mussarela, Alho e Óleo",135.5,4,1,0
113,Cliente_113,5.86,Entrega Rápida,PIX,2024-05-05 22:07:00,"Calabresa, Strogonoff de Carne, Cerveja Long Neck, Cerveja Long Neck",84.5,4,1,1
32,Cliente_32,5.04,Entrega Padrão,PIX,2024-09-07 22:07:00,"Palmito, Abacaxi, Vegetariana, Cerveja Long Neck, Cerveja Long Neck",103.5,5,1,1
189,Cliente_189,4.92,Retirada,Cartão Débito,2024-08-05 22:02:00,"Milho com Bacon, Frango com Catupiry, Romeu e Julieta, Refrigerante Lata, Cerveja Lata, Refrigerante 2L",104.0,6,1,1
67,Cliente_67,1.07,Entrega Padrão,Cartão Débito,2024-05-10 22:29:00,"Prestígio, Prestígio, Cerveja Lata, Refrigerante Lata, Refrigerante 2L",71.0,5,1,1
131,Cliente_131,7.24,Entrega Padrão,PIX,2024-09-19 22:54:00,"Mexicana, Sorvete, Refrigerante 2L, Cerveja Lata",75.0,4,1,1
92,Cliente_92,2.42,Retirada,PIX,2024-06-25 21:38:00,"Romeu e Julieta, Carne Seca, Mussarela, Margarida, Cerveja Lata, Cerveja Lata, Cerveja Long Neck",160.0,7,1,1
112,Cliente_112,8.22,Entrega Rápida,Cartão Débito,2024-02-04 21:55:00,"Refrigerante 2L, Cerveja Lata",17.0,2,0,1
14,Cliente_14,5.24,Retirada,Dinheiro,2024-10-05 23:52:00,"Pepperoni, Refrigerante Lata, Refrigerante 2L, Cerveja Lata",53.0,4,1,1
105,Cliente_105,2.23,Retirada,Cartão Débito,2024-08-17 18:42:00,"Palmito, Calabresa, Mexicana, Refrigerante 2L, Cerveja Lata",106.0,5,1,1
104,Cliente_104,4.73,Entrega Rápida,PIX,2024-09-11 21:05:00,"Margarida, Prestígio, Cerveja Lata, Cerveja Lata",65.0,4,1,1
165,Cliente_165,10.48,Retirada,Cartão Débito,2024-02-26 23:04:00,"Pepperoni, Lombo com Catupiry, Lombo com Catupiry, Banana com Canela, Refrigerante 2L, Cerveja Long Neck, Cerveja Long Neck",146.5,7,1,1
150,Cliente_150,2.23,Entrega Padrão,Cartão Crédito,2024-04-26 18:14:00,"Frango com Catupiry, Lombo com Catupiry, Sorvete, Refrigerante Lata",91.0,4,1,1
122,Cliente_122,3.49,Retirada,Cartão Crédito,2024-05-28 19:06:00,"Napolitana, Milho com Bacon",54.0,2,1,0
26,Cliente_26,11.41,Entrega Rápida,Dinheiro,2024-12-07 21:24:00,"Romeu e Julieta, Prestígio, Atum",76.0,3,1,0
20,Cliente_20,13.14,Retirada,Cartão Débito,2024-06-14 21:20:00,"Sorvete, Margarida, Strogonoff de Carne, Cerveja Lata, Refrigerante 2L",102.5,5,1,1
124,Cliente_124,3.36,Entrega Padrão,Cartão Crédito,2024-09-25 22:03:00,Sorvete,26.0,1,1,0
69,Cliente_69,14.61,Retirada,PIX,2024-03-03 18:03:00,"Frango com Catupiry, Sorvete, Sorvete, Abacaxi, Pesto",132.5,5,1,0
74,Cliente_74,12.38,Retirada,Cartão Débito,2024-02-13 20:05:00,,0.0,0,0,0
54,Cliente_54,9.84,Entrega Rápida,Cartão Débito,2024-09-10 21:35:00,"Frango com Catupiry, Cerveja Lata, Cerveja Lata, Cerveja Lata",51.0,4,1,1
