160,Cliente_160,2.42,Entrega Padrão,Cartão Débito,2024-08-14 20:16:00,"Napolitana, Catupiry",55.0,2,1,0
78,Cliente_78,3.15,Entrega Padrão,Cartão Débito,2024-09-27 19:30:00,"Prestígio, Português, Chocolate, Vegetariana, Refrigerante Lata, Cerveja Long Neck",118.5,6,1,1
65,Cliente_65,10.85,Entrega Padrão,Cartão Débito,2024-01-31 23:24:00,"Chocolate, Romeu e Julieta, Sorvete, Catupiry, Palmito, Cerveja Lata",137.5,6,1,1
150,Cliente_150,13.66,Entrega Padrão,Cartão Crédito,2024-10-17 18:54:00,"Atum, Brócolis com Bacon, Strogonoff de Frango, Mussarela, Banana com Canela, Refrigerante 2L, Cerveja Lata",179.0,7,1,1
75,Cliente_75,10.39,Entrega Padrão,PIX,2024-04-15 20:44:00,"Vegetariana, Strogonoff de Carne, Lombo com Catupiry, Pesto, Mussarela, Refrigerante 2L, Refrigerante 2L",187.5,7,1,1
76,Cliente_76,6.71,Retirada,Cartão Débito,2024-11-02 19:17:00,"Camarão, Banana com Canela, Alho e Óleo, Sorvete, Strogonoff de Frango",141.0,5,1,0
143,Cliente_143,10.39,Entrega Padrão,Cartão Crédito,2024-12-19 23:06:00,"Brócolis com Bacon, Strogonoff de Frango, Milho com Bacon, Cerveja Lata, Cerveja Long Neck",110.0,5,1,1
28,Cliente_28,1.04,Retirada,Dinheiro,2024-11-06 22:27:00,"Carne Seca, Palmito, Bacon, Romeu e Julieta, Cerveja Lata, Refrigerante Lata, Refrigerante Lata",132.5,7,1,1
173,Cliente_173,7.98,Retirada,Cartão Crédito,2024-05-17 18:23:00,"Banana com Canela, Strogonoff de Carne",54.5,2,1,0
41,Cliente_41,2.57,Entrega Rápida,PIX,2024-07-06 23:04:00,"Português, Alho e Óleo, Quatro Queijos, Palmito, Pepperoni, Cerveja Long Neck, Cerveja Long Neck, Cerveja Lata",174.5,8,1,1
50,Cliente_50,11.92,Entrega Rápida,Dinheiro,2024-03-15 21:38:00,"Milho com Bacon, Mexicana, Pesto, Cerveja Lata, Refrigerante 2L, Refrigerante Lata",110.0,6,1,1
6,Cliente_6,11.8,Entrega Padrão,Dinheiro,2024-06-15 22:13:00,"Atum, Cerveja Long Neck, Cerveja Long Neck",52.0,3,1,1
187,Cliente_187,8.63,Retirada,Dinheiro,2024-01-28 20:56:00,,0.0,0,0,0
36,Cliente_36,10.76,Retirada,Cartão Crédito,2024-12-18 20:05:00,"Chocolate, Mexicana, Prestígio, Camarão, Refrigerante 2L, Cerveja Lata",130.5,6,1,1
47,Cliente_47,7.28,Entrega Rápida,Dinheiro,2024-11-24 21:59:00,"Chocolate com Morango, Vegetariana, Cerveja Lata",59.0,3,1,1
85,Cliente_85,3.45,Retirada,Dinheiro,2024-05-08 18:14:00,"Carne Seca, Bacon, Strogonoff de Frango, Refrigerante Lata, Cerveja Long Neck, Refrigerante 2L",122.0,6,1,1
73,Cliente_73,4.77,Retirada,PIX,2024-04-13 21:36:00,"Frango com Catupiry, Atum, Mussarela, Calabresa, Frango com Catupiry, Refrigerante Lata, Refrigerante 2L, Cerveja Long Neck",192.5,8,1,1
38,Cliente_38,5.08,Retirada,Cartão Débito,2024-08-02 22:32:00,"Bacon, Chocolate",50.5,2,1,0
37,Cliente_37,2.26,Entrega Padrão,Dinheiro,2024-11-12 21:44:00,"Mussarela, Sorvete, Quatro Queijos, Refrigerante 2L",115.0,4,1,1
108,Cliente_108,4.22,Entrega Padrão,Dinheiro,2024-05-21 23:56:00,"Quatro Queijos, Camarão, Palmito, Cerveja Lata",100.5,4,1,1
81,Cliente_81,11.3,Entrega Rápida,Cartão Crédito,2024-07-17 19:28:00,"Abacaxi, Cerveja Long Neck",35.0,2,1,1
60,Cliente_60,0.98,Entrega Rápida,Cartão Crédito,2024-01-31 22:24:00,"Carne Seca, Frango com Catupiry, Quatro Queijos, Cerveja Lata",100.0,4,1,1
31,Cliente_31,1.53,Retirada,PIX,2024-07-31 19:33:00,"Palmito, Chocolate com Morango, Camarão, Refrigerante 2L, Refrigerante 2L, Refrigerante 2L",119.5,6,1,1
158,Cliente_158,6.47,Retirada,Dinheiro,2024-03-05 21:14:00,"Camarão, Romeu e Julieta, Quatro Queijos, Lombo com Catupiry, Cerveja Lata, Refrigerante 2L",134.5,6,1,1
192,Cliente_192,9.74,Retirada,PIX,2024-07-12 22:59:00,"Vegetariana, Alho e Óleo, Palmito, Napolitana, Bacon, Refrigerante 2L, Cerveja Lata, Cerveja Lata",160.5,8,1,1
142,Cliente_142,11.84,Entrega Padrão,Cartão Débito,2024-01-22 19:04:00,"Milho com Bacon, Banana com Canela, Sorvete, Pepperoni, Cerveja Lata",114.0,5,1,1
70,Cliente_70,14.29,Entrega Padrão,Dinheiro,2024-11-12 20:21:00,"Strogonoff de Frango, Cerveja Long Neck, Cerveja Long Neck",56.5,3,1,1
134,Cliente_134,4.44,Retirada,Cartão Débito,2024-07-27 20:05:00,"Milho com Bacon, Chocolate, Carne Seca, Cerveja Long Neck",96.5,4,1,1
73,Cliente_73,12.77,Entrega Rápida,PIX,2024-03-07 18:55:00,"Lombo com Catupiry, Vegetariana, Bacon, Lombo com Catupiry, Refrigerante 2L, Cerveja Lata, Cerveja Long Neck",144.5,7,1,1
164,Cliente_164,13.86,Retirada,Cartão Crédito,2024-02-26 20:12:00,,0.0,0,0,0
174,Cliente_174,7.48,Entrega Rápida,Cartão Débito,2024-01-26 20:40:00,"Camarão, Atum, Cerveja Lata, Cerveja Lata, Refrigerante 2L",87.0,5,1,1
20,Cliente_20,9.33,Entrega Padrão,Cartão Débito,2024-02-01 21:24:00,"Romeu e Julieta, Lombo com Catupiry, Napolitana, Atum, Cerveja Lata, Refrigerante Lata",119.0,6,1,1
9,Cliente_9,7.18,Entrega Padrão,Dinheiro,2024-05-06 20:45:00,"Margarida, Carne Seca, Frango com Catupiry",90.5,3,1,0
22,Cliente_22,3.0,Retirada,Cartão Débito,2024-06-21 18:28:00,"Refrigerante Lata, Refrigerante 2L",15.0,2,0,1
29,Cliente_29,0.58,Entrega Padrão,PIX,2024-07-24 23:59:00,"Margarida, Pesto, Refrigerante 2L, Refrigerante 2L, Refrigerante 2L",84.0,5,1,1
12,Cliente_12,9.85,Retirada,PIX,2024-07-15 21:06:00,"Calabresa, Chocolate, Quatro Queijos, Banana com Canela, Napolitana, Cerveja Long Neck, Refrigerante 2L",147.5,7,1,1
132,Cliente_132,14.04,Entrega Rápida,PIX,2024-03-25 18:11:00,"Atum, Sorvete, Pepperoni",85.0,3,1,0
130,Cliente_130,12.79,Entrega Rápida,Dinheiro,2024-11-01 19:20:00,"Alho e Óleo, Margarida, Quatro Queijos, Atum, Refrigerante 2L, Refrigerante 2L, Refrigerante 2L",139.5,7,1,1
166,Cliente_166,14.06,Retirada,PIX,2024-11-07 20:29:00,"Prestígio, Cerveja Lata, Refrigerante 2L, Cerveja Lata",48.5,4,1,1
118,Cliente_118,7.23,Entrega Rápida,Cartão Crédito,2024-05-22 22:52:00,"Vegetariana, Banana com Canela, Napolitana",74.0,3,1,0
178,Cliente_178,8.42,Entrega Padrão,Dinheiro,2024-03-21 22:58:00,"Sorvete, Pesto, Refrigerante Lata, Cerveja Long Neck, Cerveja Lata",77.5,5,1,1
151,Cliente_151,1.8,Entrega Padrão,Dinheiro,2024-08-01 23:27:00,"Sorvete, Milho com Bacon, Strogonoff de Carne, Alho e Óleo, Refrigerante 2L",123.5,5,1,1
92,Cliente_92,12.85,Entrega Padrão,Cartão Débito,2024-10-21 22:41:00,"Strogonoff de Carne, Catupiry",62.5,2,1,0
107,Cliente_107,2.48,Retirada,PIX,2024-06-25 20:34:00,"Frango com Catupiry, Margarida, Brócolis com Bacon, Refrigerante 2L, Refrigerante Lata",101.5,5,1,1
147,Cliente_147,13.46,Entrega Padrão,Cartão Débito,2024-05-06 19:25:00,"Quatro Queijos, Margarida, Mussarela, Prestígio, Sorvete, Refrigerante 2L, Refrigerante 2L",176.0,7,1,1
61,Cliente_61,14.66,Entrega Rápida,Dinheiro,2024-12-04 21:45:00,Carne Seca,34.0,1,1,0
33,Cliente_33,14.76,Entrega Padrão,PIX,2024-01-26 23:38:00,"Vegetariana, Mussarela, Bacon, Frango com Catupiry, Catupiry",165.0,5,1,0
144,Cliente_144,13.93,Entrega Rápida,PIX,2024-06-24 19:21:00,Cerveja Long Neck,12.0,1,0,1
189,Cliente_189,9.77,Retirada,Cartão Débito,2024-10-14 20:26:00,"Alho e Óleo, Frango com Catupiry, Camarão, Vegetariana, Cerveja Lata",125.0,5,1,1
51,Cliente_51,3.7,Entrega Padrão,Dinheiro,2024-11-09 22:31:00,"Atum, Cerveja Lata",35.0,2,1,1
115,Cliente_115,7.74,Entrega Padrão,PIX,2024-10-04 19:29:00,"Cerveja Long Neck, Cerveja Lata, Refrigerante Lata",24.0,3,0,1
169,Cliente_169,2.65,Retirada,PIX,2024-09-05 19:07:00,"Palmito, Mexicana",61.5,2,1,0
119,Cliente_119,10.18,Retirada,Cartão Débito,2024-02-18 22:41:00,"Strogonoff de Frango, Banana com Canela, Romeu e Julieta, Cerveja Long Neck, Cerveja Lata",96.5,5,1,1
150,Cliente_150,2.48,Retirada,Dinheiro,2024-01-26 20:26:00,"Cerveja Lata, Cerveja Lata, Refrigerante Lata",19.0,3,0,1
97,Cliente_97,8.06,Retirada,Dinheiro,2024-10-15 20:44:00,"Cerveja Long Neck, Refrigerante 2L, Cerveja Long Neck",34.0,3,0,1
24,Cliente_24,3.98,Entrega Rápida,Dinheiro,2024-09-16 21:21:00,"Pepperoni, Romeu e Julieta, Strogonoff de Carne, Português, Refrigerante Lata, Refrigerante Lata",125.5,6,1,1
140,Cliente_140,1.02,Retirada,Cartão Débito,2024-10-02 23:39:00,"Abacaxi, Bacon, Chocolate, Brócolis com Bacon, Cerveja Long Neck, Cerveja Lata, Refrigerante 2L",132.5,7,1,1
164,Cliente_164,8.33,Entrega Padrão,Cartão Débito,2024-09-30 18:56:00,"Cerveja Lata, Refrigerante Lata",12.0,2,0,1
183,Cliente_183,3.64,Entrega Padrão,Cartão Débito,2024-11-28 20:55:00,"Milho com Bacon, Chocolate com Morango, Palmito, Refrigerante 2L, Refrigerante 2L",103.0,5,1,1
26,Cliente_26,7.45,Retirada,Dinheiro,2024-07-29 22:22:00,"Abacaxi, Milho com Bacon, Pesto, Cerveja Lata, Refrigerante Lata",91.0,5,1,1
1,Cliente_1,3.31,Entrega Padrão,Cartão Crédito,2024-09-04 23:40:00,"Cerveja Lata, Cerveja Lata, Cerveja Lata",21.0,3,0,1
161,Cliente_161,11.0,Entrega Padrão,Cartão Crédito,2024-06-24 19:47:00,"Frango com Catupiry, Mexicana, Prestígio, Cerveja Long Neck, Refrigerante 2L, Refrigerante 2L",118.5,6,1,1
200,Cliente_200,5.24,Entrega Padrão,PIX,2024-05-30 23:51:00,"Chocolate, Strogonoff de Carne, Bacon, Mexicana, Chocolate com Morango, Refrigerante 2L",150.5,6,1,1
184,Cliente_184,14.28,Entrega Rápida,Cartão Crédito,2024-11-23 21:14:00,"Atum, Frango com Catupiry, Cerveja Lata, Cerveja Lata, Refrigerante Lata",77.0,5,1,1
97,Cliente_97,13.6,Entrega Rápida,Cartão Débito,2024-09-03 22:16:00,Cerveja Lata,7.0,1,0,1
56,Cliente_56,4.9,Entrega Rápida,PIX,2024-10-03 18:06:00,Cerveja Lata,7.0,1,0,1
153,Cliente_153,14.45,Retirada,Cartão Crédito,2024-06-20 21:31:00,"Milho com Bacon, Mexicana, Bacon, Vegetariana, Cerveja Long Neck, Cerveja Long Neck",140.0,6,1,1
145,Cliente_145,10.47,Retirada,PIX,2024-10-24 18:18:00,"Quatro Queijos, Calabresa, Napolitana, Calabresa, Cerveja Lata",116.5,5,1,1
197,Cliente_197,10.13,Entrega Padrão,Cartão Crédito,2024-01-02 19:20:00,"Margarida, Frango com Catupiry, Refrigerante Lata, Cerveja Lata",68.5,4,1,1
50,Cliente_50,12.05,Entrega Padrão,Cartão Débito,2024-01-14 19:52:00,"Frango com Catupiry, Mexicana, Calabresa, Cerveja Lata, Cerveja Long Neck, Cerveja Long Neck",120.5,6,1,1
1,Cliente_1,9.14,Retirada,Cartão Crédito,2024-03-28 18:17:00,"Refrigerante 2L, Cerveja Long Neck, Cerveja Lata",29.0,3,0,1
154,Cliente_154,6.14,Retirada,PIX,2024-01-18 20:15:00,"Margarida, Refrigerante Lata, Cerveja Long Neck",43.5,3,1,1
40,Cliente_40,11.79,Entrega Rápida,PIX,2024-08-10 18:30:00,"Margarida, Frango com Catupiry, Mussarela, Camarão, Cerveja Long Neck, Refrigerante Lata",158.5,6,1,1
27,Cliente_27,7.43,Entrega Rápida,Cartão Crédito,2024-07-07 20:35:00,"Alho e Óleo, Catupiry, Brócolis com Bacon, Frango com Catupiry, Refrigerante 2L, Cerveja Long Neck, Cerveja Long Neck",149.5,7,1,1
117,Cliente_117,12.14,Entrega Rápida,PIX,2024-06-24 23:45:00,,0.0,0,0,0
40,Cliente_40,5.95,Entrega Rápida,Cartão Débito,2024-12-06 20:29:00,"Carne Seca, Margarida, Refrigerante 2L",70.5,3,1,1
48,Cliente_48,3.73,Entrega Rápida,PIX,2024-10-11 20:46:00,"Banana com Canela, Strogonoff de Frango, Refrigerante Lata, Cerveja Lata",66.0,4,1,1
150,Cliente_150,10.01,Entrega Rápida,Cartão Crédito,2024-12-11 20:05:00,"Strogonoff de Carne, Catupiry, Milho com Bacon, Cerveja Long Neck",103.0,4,1,1
68,Cliente_68,13.75,Retirada,Dinheiro,2024-01-12 21:09:00,"Cerveja Lata, Refrigerante 2L, Cerveja Lata",24.0,3,0,1
117,Cliente_117,5.77,Entrega Padrão,PIX,2024-10-31 20:04:00,Cerveja Long Neck,12.0,1,0,1
41,Cliente_41,2.73,Entrega Rápida,Cartão Débito,2024-06-28 21:23:00,"Prestígio, Mussarela, Pesto, Carne Seca, Cerveja Long Neck, Refrigerante 2L, Refrigerante Lata",163.0,7,1,1
71,Cliente_71,0.71,Entrega Rápida,PIX,2024-02-04 22:28:00,Português,28.0,1,1,0
179,Cliente_179,2.26,Entrega Padrão,Cartão Débito,2024-03-08 18:24:00,"Bacon, Pepperoni, Atum, Refrigerante 2L, Cerveja Long Neck",109.5,5,1,1
46,Cliente_46,5.69,Retirada,Cartão Débito,2024-06-15 23:45:00,"Napolitana, Strogonoff de Carne, Bacon, Chocolate, Refrigerante Lata, Cerveja Lata, Refrigerante Lata",126.0,7,1,1
69,Cliente_69,2.13,Entrega Padrão,Dinheiro,2024-12-23 21:52:00,"Bacon, Banana com Canela, Mexicana, Frango com Catupiry, Strogonoff de Frango, Refrigerante 2L",154.5,6,1,1
105,Cliente_105,8.81,Entrega Rápida,Dinheiro,2024-09-20 21:49:00,"Camarão, Refrigerante Lata, Refrigerante Lata, Cerveja Lata",52.0,4,1,1
68,Cliente_68,12.94,Retirada,PIX,2024-08-07 23:33:00,"Strogonoff de Frango, Pesto, Carne Seca, Catupiry, Cerveja Long Neck",135.5,5,1,1
79,Cliente_79,11.65,Entrega Rápida,Dinheiro,2024-11-28 23:44:00,"Bacon, Mussarela, Margarida, Strogonoff de Carne, Cerveja Long Neck, Refrigerante Lata",155.0,6,1,1
84,Cliente_84,8.82,Entrega Padrão,Cartão Débito,2024-03-11 18:55:00,,0.0,0,0,0
4,Cliente_4,7.26,Entrega Padrão,PIX,2024-07-15 20:19:00,Refrigerante Lata,5.0,1,0,1
165,Cliente_165,2.88,Retirada,Dinheiro,2024-11-29 21:34:00,"Vegetariana, Refrigerante Lata",32.0,2,1,1
193,Cliente_193,8.95,Entrega Rápida,Dinheiro,2024-12-21 22:58:00,"Chocolate com Morango, Frango com Catupiry, Pepperoni, Cerveja Lata, Refrigerante 2L",103.0,5,1,1
116,Cliente_116,2.4,Retirada,Cartão Débito,2024-05-31 22:33:00,"Carne Seca, Calabresa",61.5,2,1,0
78,Cliente_78,10.03,Entrega Rápida,Dinheiro,2024-09-10 23:29:00,"Catupiry, Cerveja Long Neck, Cerveja Lata, Cerveja Long Neck",60.5,4,1,1
92,Cliente_92,6.25,Entrega Rápida,Cartão Débito,2024-05-28 20:03:00,"Pepperoni, Cerveja Long Neck, Cerveja Long Neck",55.0,3,1,1
16,Cliente_16,12.26,Retirada,PIX,2024-01-27 18:06:00,"Atum, Refrigerante 2L",38.0,2,1,1
123,Cliente_123,3.9,Retirada,PIX,2024-01-08 21:11:00,"Romeu e Julieta, Bacon, Cerveja Lata",59.0,3,1,1
80,Cliente_80,9.62,Entrega Rápida,Dinheiro,2024-01-22 23:56:00,"Bacon, Carne Seca, Mexicana, Mexicana, Mussarela, Refrigerante 2L, Cerveja Long Neck",198.5,7,1,1
1,Cliente_1,3.15,Retirada,PIX,2024-05-28 23:00:00,Catupiry,29.5,1,1,0
28,Cliente_28,4.67,Retirada,Dinheiro,2024-08-25 20:59:00,"Mussarela, Chocolate, Margarida, Camarão, Napolitana, Cerveja Long Neck, Cerveja Lata, Cerveja Lata",185.0,8,1,1
92,Cliente_92,13.0,Entrega Rápida,Cartão Crédito,2024-09-15 23:30:00,"Milho com Bacon, Palmito, Refrigerante 2L, Refrigerante 2L",78.0,4,1,1
76,Cliente_76,10.94,Entrega Rápida,PIX,2024-08-18 18:02:00,Cerveja Long Neck,12.0,1,0,1
14,Cliente_14,3.74,Entrega Padrão,Dinheiro,2024-04-15 21:34:00,"Cerveja Long Neck, Cerveja Long Neck",24.0,2,0,1
126,Cliente_126,10.55,Entrega Rápida,Cartão Débito,2024-10-25 21:46:00,"Mexicana, Mexicana, Banana com Canela",85.5,3,1,0
180,Cliente_180,9.81,Entrega Padrão,Cartão Crédito,2024-07-07 22:12:00,"Bacon, Prestígio, Abacaxi",76.0,3,1,0
66,Cliente_66,12.36,Entrega Padrão,Dinheiro,2024-12-13 23:34:00,"Atum, Romeu e Julieta, Milho com Bacon, Napolitana, Refrigerante Lata",110.5,5,1,1
180,Cliente_180,1.46,Entrega Rápida,Cartão Crédito,2024-11-08 19:55:00,"Refrigerante Lata, Cerveja Lata, Refrigerante Lata",17.0,3,0,1
150,Cliente_150,4.93,Retirada,Cartão Crédito,2024-05-19 23:29:00,"Cerveja Lata, Cerveja Lata",14.0,2,0,1
32,Cliente_32,5.41,Retirada,PIX,2024-03-27 22:36:00,"Atum, Napolitana, Camarão, Calabresa, Cerveja Lata, Cerveja Lata, Cerveja Lata",137.0,7,1,1
98,Cliente_98,12.5,Retirada,PIX,2024-07-07 20:55:00,"Cerveja Long Neck, Cerveja Long Neck, Refrigerante Lata",29.0,3,0,1
132,Cliente_132,3.98,Retirada,PIX,2024-09-08 20:09:00,"Pesto, Romeu e Julieta",51.0,2,1,0
58,Cliente_58,6.51,Entrega Rápida,Cartão Crédito,2024-06-12 21:39:00,"Strogonoff de Frango, Lombo com Catupiry, Palmito, Palmito, Refrigerante 2L, Cerveja Lata",138.5,6,1,1
111,Cliente_111,12.3,Entrega Padrão,PIX,2024-09-05 21:18:00,"Mussarela, Prestígio, Vegetariana, Frango com Catupiry, Cerveja Lata",138.5,5,1,1
84,Cliente_84,7.48,Entrega Rápida,Dinheiro,2024-12-17 19:34:00,Refrigerante Lata,5.0,1,0,1
188,Cliente_188,9.76,Retirada,Cartão Débito,2024-06-26 19:21:00,"Milho com Bacon, Chocolate, Frango com Catupiry, Strogonoff de Frango",113.0,4,1,0
112,Cliente_112,1.88,Entrega Padrão,Cartão Crédito,2024-03-18 21:05:00,,0.0,0,0,0
77,Cliente_77,1.14,Entrega Padrão,Dinheiro,2024-12-15 23:19:00,"Frango com Catupiry, Romeu e Julieta, Quatro Queijos, Português, Camarão, Cerveja Lata, Refrigerante 2L",162.5,7,1,1
117,Cliente_117,5.4,Entrega Padrão,Dinheiro,2024-06-18 21:15:00,"Napolitana, Português, Cerveja Long Neck, Cerveja Lata, Cerveja Lata",79.5,5,1,1
26,Cliente_26,5.1,Entrega Rápida,Dinheiro,2024-11-16 18:53:00,"Palmito, Banana com Canela, Margarida",77.5,3,1,0
36,Cliente_36,1.86,Entrega Padrão,Cartão Débito,2024-10-04 19:57:00,"Calabresa, Abacaxi, Milho com Bacon, Pepperoni, Refrigerante Lata, Cerveja Lata, Cerveja Lata",129.0,7,1,1
125,Cliente_125,0.57,Entrega Padrão,PIX,2024-03-07 19:10:00,"Pepperoni, Milho com Bacon, Refrigerante Lata, Refrigerante 2L",74.5,4,1,1
31,Cliente_31,10.15,Retirada,Cartão Débito,2024-08-20 18:44:00,"Milho com Bacon, Brócolis com Bacon",58.5,2,1,0
114,Cliente_114,6.13,Entrega Rápida,Cartão Crédito,2024-10-16 20:12:00,"Napolitana, Alho e Óleo, Palmito, Carne Seca",115.0,4,1,0
172,Cliente_172,5.32,Retirada,Dinheiro,2024-05-03 21:28:00,"Palmito, Strogonoff de Carne, Carne Seca, Abacaxi, Cerveja Long Neck",131.5,5,1,1
116,Cliente_116,10.99,Entrega Padrão,Cartão Débito,2024-01-03 23:44:00,"Pesto, Camarão, Banana com Canela, Margarida, Refrigerante Lata, Cerveja Long Neck",127.5,6,1,1
17,Cliente_17,14.03,Entrega Padrão,Cartão Débito,2024-01-08 19:23:00,"Camarão, Chocolate com Morango, Calabresa, Strogonoff de Carne, Quatro Queijos, Refrigerante Lata, Cerveja Lata",161.5,7,1,1
27,Cliente_27,12.11,Retirada,PIX,2024-05-01 19:14:00,"Cerveja Lata, Cerveja Lata, Cerveja Long Neck",26.0,3,0,1
175,Cliente_175,2.11,Retirada,Cartão Crédito,2024-10-30 20:59:00,"Frango com Catupiry, Pesto, Calabresa, Chocolate com Morango, Mexicana, Cerveja Lata",149.0,6,1,1
70,Cliente_70,7.21,Entrega Rápida,Cartão Débito,2024-06-17 19:50:00,"Strogonoff de Frango, Lombo com Catupiry, Pesto, Quatro Queijos, Alho e Óleo, Cerveja Long Neck, Cerveja Long Neck",169.0,7,1,1
23,Cliente_23,2.2,Entrega Rápida,Cartão Crédito,2024-01-21 18:48:00,"Palmito, Quatro Queijos, Refrigerante Lata",63.5,3,1,1
106,Cliente_106,2.28,Entrega Rápida,Dinheiro,2024-08-16 21:45:00,"Napolitana, Mexicana, Português, Refrigerante 2L, Cerveja Long Neck",107.5,5,1,1
178,Cliente_178,1.81,Retirada,Dinheiro,2024-05-24 22:31:00,"Mussarela, Camarão",85.0,2,1,0
169,Cliente_169,2.49,Entrega Rápida,Dinheiro,2024-10-04 22:18:00,"Carne Seca, Banana com Canela, Carne Seca, Sorvete, Refrigerante Lata",120.5,5,1,1
122,Cliente_122,10.66,Retirada,Cartão Débito,2024-02-13 20:14:00,"Romeu e Julieta, Abacaxi, Pesto, Cerveja Long Neck, Cerveja Long Neck",98.0,5,1,1
120,Cliente_120,6.37,Entrega Padrão,PIX,2024-03-15 19:36:00,Refrigerante Lata,5.0,1,0,1
76,Cliente_76,0.51,Entrega Rápida,PIX,2024-07-03 20:30:00,"Palmito, Abacaxi, Calabresa, Português, Vegetariana, Cerveja Lata",142.0,6,1,1
78,Cliente_78,0.99,Entrega Padrão,PIX,2024-09-08 19:28:00,"Lombo com Catupiry, Pepperoni, Mexicana, Brócolis com Bacon, Pepperoni",154.0,5,1,0
104,Cliente_104,10.22,Retirada,PIX,2024-05-31 18:32:00,"Brócolis com Bacon, Palmito, Banana com Canela, Cerveja Long Neck, Refrigerante 2L, Cerveja Long Neck",115.0,6,1,1
186,Cliente_186,5.65,Retirada,PIX,2024-06-30 21:36:00,"Bacon, Strogonoff de Carne, Bacon, Cerveja Lata, Refrigerante 2L, Cerveja Lata",114.0,6,1,1
145,Cliente_145,14.05,Entrega Padrão,PIX,2024-01-28 19:43:00,"Calabresa, Vegetariana, Margarida, Cerveja Lata, Cerveja Long Neck, Cerveja Lata",107.0,6,1,1
11,Cliente_11,1.5,Entrega Padrão,Dinheiro,2024-04-24 18:39:00,,0.0,0,0,0
155,Cliente_155,11.7,Retirada,Cartão Crédito,2024-08-13 22:38:00,"Milho com Bacon, Chocolate com Morango, Refrigerante Lata",58.5,3,1,1
36,Cliente_36,10.34,Retirada,PIX,2024-08-11 23:01:00,"Calabresa, Banana com Canela, Lombo com Catupiry, Lombo com Catupiry, Brócolis com Bacon",139.0,5,1,0
190,Cliente_190,14.19,Entrega Padrão,Cartão Débito,2024-08-01 18:07:00,"Chocolate, Romeu e Julieta, Catupiry, Camarão, Refrigerante Lata, Cerveja Long Neck",127.0,6,1,1
25,Cliente_25,1.75,Entrega Rápida,Cartão Débito,2024-03-09 23:19:00,"Atum, Chocolate, Strogonoff de Frango, Napolitana, Strogonoff de Frango",140.5,5,1,0
162,Cliente_162,6.14,Retirada,Dinheiro,2024-06-23 23:26:00,"Refrigerante Lata, Cerveja Lata, Cerveja Long Neck",24.0,3,0,1
77,Cliente_77,7.97,Retirada,Cartão Crédito,2024-07-12 22:43:00,"Pesto, Carne Seca, Mexicana, Frango com Catupiry, Refrigerante Lata, Cerveja Long Neck, Refrigerante 2L",150.5,7,1,1
161,Cliente_161,4.18,Retirada,Cartão Crédito,2024-05-03 20:08:00,"Prestígio, Camarão",59.5,2,1,0
18,Cliente_18,11.83,Entrega Padrão,Cartão Crédito,2024-02-23 20:34:00,"Milho com Bacon, Refrigerante Lata",33.5,2,1,1
176,Cliente_176,8.27,Retirada,PIX,2024-07-24 22:18:00,"Bacon, Cerveja Lata, Refrigerante Lata",40.5,3,1,1
2,Cliente_2,14.75,Retirada,Cartão Débito,2024-12-30 21:55:00,"Palmito, Camarão, Cerveja Lata, Cerveja Long Neck",83.5,4,1,1
15,Cliente_15,1.3,Entrega Padrão,Dinheiro,2024-11-08 20:31:00,Alho e Óleo,26.0,1,1,0
2,Cliente_2,5.87,Retirada,Cartão Débito,2024-03-09 21:20:00,"Bacon, Mexicana, Palmito, Pepperoni",121.0,4,1,0
40,Cliente_40,7.13,Entrega Padrão,Cartão Crédito,2024-09-27 19:30:00,"Pepperoni, Vegetariana, Cerveja Lata",65.0,3,1,1
128,Cliente_128,9.32,Retirada,PIX,2024-11-18 19:16:00,"Napolitana, Strogonoff de Carne, Refrigerante Lata",63.5,3,1,1
141,Cliente_141,2.58,Entrega Rápida,Dinheiro,2024-09-08 21:50:00,"Romeu e Julieta, Palmito, Chocolate, Palmito, Abacaxi, Refrigerante 2L, Refrigerante Lata",142.5,7,1,1
86,Cliente_86,11.0,Retirada,Cartão Crédito,2024-12-28 19:08:00,"Milho com Bacon, Cerveja Lata",35.5,2,1,1
100,Cliente_100,2.01,Entrega Rápida,Cartão Crédito,2024-09-16 19:18:00,"Sorvete, Chocolate, Bacon, Cerveja Long Neck",88.5,4,1,1
186,Cliente_186,12.38,Entrega Padrão,PIX,2024-08-31 23:27:00,"Catupiry, Sorvete, Mussarela, Catupiry, Strogonoff de Frango, Refrigerante Lata, Refrigerante Lata",177.5,7,1,1
20,Cliente_20,3.17,Entrega Padrão,Cartão Crédito,2024-10-21 21:04:00,"Brócolis com Bacon, Alho e Óleo, Chocolate, Quatro Queijos",107.0,4,1,0
193,Cliente_193,1.11,Entrega Padrão,Dinheiro,2024-02-08 20:00:00,"Mexicana, Cerveja Long Neck",44.0,2,1,1
70,Cliente_70,8.99,Entrega Padrão,PIX,2024-11-12 22:22:00,"Brócolis com Bacon, Chocolate com Morango, Refrigerante Lata",60.0,3,1,1
164,Cliente_164,8.04,Entrega Rápida,PIX,2024-05-14 19:07:00,"Carne Seca, Refrigerante Lata",39.0,2,1,1
166,Cliente_166,12.87,Entrega Padrão,Dinheiro,2024-08-07 20:42:00,"Frango com Catupiry, Vegetariana, Cerveja Lata",64.0,3,1,1
156,Cliente_156,5.16,Retirada,Cartão Crédito,2024-05-31 20:29:00,"Milho com Bacon, Sorvete, Refrigerante 2L, Refrigerante 2L, Refrigerante Lata",79.5,5,1,1
43,Cliente_43,2.28,Entrega Rápida,Dinheiro,2024-09-30 20:53:00,"Strogonoff de Frango, Português, Atum, Alho e Óleo",114.5,4,1,0
161,Cliente_161,14.0,Entrega Rápida,Cartão Débito,2024-01-29 20:10:00,"Romeu e Julieta, Cerveja Lata, Cerveja Long Neck, Cerveja Lata",49.5,4,1,1
28,Cliente_28,4.95,Retirada,Cartão Crédito,2024-03-19 21:42:00,"Quatro Queijos, Refrigerante Lata, Refrigerante 2L, Refrigerante Lata",49.0,4,1,1
188,Cliente_188,9.75,Entrega Rápida,PIX,2024-05-16 22:52:00,"Quatro Queijos, Mexicana, Quatro Queijos, Catupiry",119.5,4,1,0
16,Cliente_16,7.9,Entrega Rápida,Cartão Débito,2024-04-10 20:06:00,"Frango com Catupiry, Catupiry, Português, Cerveja Long Neck",99.5,4,1,1
168,Cliente_168,13.46,Retirada,Dinheiro,2024-07-14 19:38:00,"Milho com Bacon, Atum, Refrigerante 2L, Cerveja Long Neck, Cerveja Long Neck",90.5,5,1,1
117,Cliente_117,11.98,Entrega Rápida,PIX,2024-04-09 21:39:00,"Lombo com Catupiry, Quatro Queijos",59.0,2,1,0
156,Cliente_156,3.03,Entrega Padrão,Cartão Débito,2024-03-26 23:13:00,"Frango com Catupiry, Margarida, Camarão, Vegetariana",118.5,4,1,0
183,Cliente_183,11.5,Entrega Padrão,PIX,2024-10-12 18:23:00,"Calabresa, Strogonoff de Carne, Pesto, Prestígio, Milho com Bacon, Cerveja Lata, Refrigerante 2L, Refrigerante Lata",163.0,8,1,1
1,Cliente_1,8.08,Entrega Padrão,PIX,2024-01-06 19:06:00,"Sorvete, Lombo com Catupiry, Refrigerante 2L, Cerveja Long Neck",78.0,4,1,1
110,Cliente_110,7.79,Retirada,Cartão Débito,2024-02-15 19:27:00,"Abacaxi, Banana com Canela, Abacaxi, Atum, Cerveja Long Neck, Refrigerante 2L, Cerveja Long Neck",129.5,7,1,1
167,Cliente_167,4.16,Retirada,Cartão Débito,2024-03-11 22:52:00,Português,28.0,1,1,0
96,Cliente_96,0.62,Entrega Rápida,Dinheiro,2024-02-08 23:58:00,"Milho com Bacon, Brócolis com Bacon, Pesto, Chocolate com Morango, Catupiry, Refrigerante Lata",145.5,6,1,1
75,Cliente_75,3.72,Retirada,Cartão Crédito,2024-11-03 18:38:00,"Sorvete, Refrigerante 2L",36.0,2,1,1
73,Cliente_73,5.5,Entrega Padrão,Cartão Débito,2024-07-21 21:44:00,"Banana com Canela, Pepperoni, Bacon, Sorvete, Refrigerante 2L, Refrigerante 2L, Cerveja Lata",134.0,7,1,1
33,Cliente_33,11.24,Entrega Rápida,Dinheiro,2024-09-07 23:20:00,"Sorvete, Português, Atum, Mussarela, Cerveja Lata",139.0,5,1,1
162,Cliente_162,8.17,Entrega Padrão,Cartão Crédito,2024-09-30 19:53:00,"Mussarela, Refrigerante 2L, Refrigerante Lata, Refrigerante Lata",70.0,4,1,1
168,Cliente_168,14.49,Entrega Padrão,PIX,2024-05-09 18:51:00,"Calabresa, Frango com Catupiry, Prestígio, Carne Seca, Margarida, Refrigerante Lata, Refrigerante 2L, Refrigerante 2L",167.5,8,1,1
40,Cliente_40,1.87,Retirada,PIX,2024-05-03 18:44:00,"Strogonoff de Frango, Bacon, Frango com Catupiry, Catupiry",120.5,4,1,0
135,Cliente_135,3.21,Retirada,PIX,2024-08-01 20:27:00,"Refrigerante 2L, Cerveja Lata, Cerveja Lata",24.0,3,0,1
90,Cliente_90,6.72,Entrega Rápida,Dinheiro,2024-06-27 18:59:00,,0.0,0,0,0
27,Cliente_27,5.53,Entrega Rápida,PIX,2024-08-14 20:57:00,"Cerveja Lata, Cerveja Lata",14.0,2,0,1
46,Cliente_46,12.4,Retirada,PIX,2024-08-30 19:34:00,"Vegetariana, Cerveja Long Neck, Refrigerante 2L, Refrigerante Lata",54.0,4,1,1
164,Cliente_164,10.02,Entrega Padrão,Dinheiro,2024-12-16 20:47:00,"Quatro Queijos, Catupiry, Mussarela, Alho e Óleo",134.5,4,1,0
